{
  "$schema": "https://json-schema.org/draft/2020-12/schema",
  "$id": "https://jichi-insight.example/schemas/aichi_policy_indicator_review_manifest.schema.json",
  "type": "object",
  "additionalProperties": false,
  "required": [
    "id",
    "prefecture_code",
    "municipality_key",
    "source_id",
    "policy_direction_count",
    "reviewed_indicator_row_count",
    "unique_indicator_count",
    "reviewed_indicator_series_count",
    "evidence_packet_count",
    "series_with_current_value",
    "series_with_target_value",
    "repost_indicator_count",
    "target_revision_event_count",
    "management_projects_evaluated_2025",
    "management_projects_without_evaluation_result_2025",
    "policy_achievement_assessed_indicator_count",
    "status",
    "updated_at",
    "next_review_scope",
    "quality_note"
  ],
  "properties": {
    "id": {
      "const": "aichi-policy-indicator-review-manifest"
    },
    "prefecture_code": {
      "const": "23"
    },
    "municipality_key": {
      "const": "aichi-prefecture"
    },
    "source_id": {
      "const": "aichi-report-2025-progress-indicators"
    },
    "policy_direction_count": {
      "const": 11
    },
    "reviewed_indicator_row_count": {
      "const": 56
    },
    "unique_indicator_count": {
      "const": 54
    },
    "reviewed_indicator_series_count": {
      "const": 62
    },
    "evidence_packet_count": {
      "const": 56
    },
    "series_with_current_value": {
      "const": 61
    },
    "series_with_target_value": {
      "const": 29
    },
    "repost_indicator_count": {
      "const": 2
    },
    "target_revision_event_count": {
      "const": 1
    },
    "management_projects_evaluated_2025": {
      "const": 296
    },
    "management_projects_without_evaluation_result_2025": {
      "const": 28
    },
    "policy_achievement_assessed_indicator_count": {
      "const": 0
    },
    "status": {
      "const": "complete"
    },
    "updated_at": {
      "type": "string",
      "format": "date"
    },
    "next_review_scope": {
      "type": "string"
    },
    "quality_note": {
      "type": "string",
      "minLength": 30
    }
  }
}
