{
  "id": "aichi-policy-indicator-review-manifest",
  "prefecture_code": "23",
  "municipality_key": "aichi-prefecture",
  "source_id": "aichi-report-2025-progress-indicators",
  "policy_direction_count": 11,
  "reviewed_indicator_row_count": 56,
  "unique_indicator_count": 54,
  "reviewed_indicator_series_count": 62,
  "evidence_packet_count": 56,
  "series_with_current_value": 61,
  "series_with_target_value": 29,
  "repost_indicator_count": 2,
  "target_revision_event_count": 1,
  "management_projects_evaluated_2025": 296,
  "management_projects_without_evaluation_result_2025": 28,
  "policy_achievement_assessed_indicator_count": 0,
  "status": "complete",
  "updated_at": "2026-07-21",
  "next_review_scope": "大阪府の政策体系・数値目標のReviewed化",
  "quality_note": "Reviewed coverage is official indicator extraction and evidence linkage, not an independent achievement assessment. The 2025 annual report current values are connected, while management-project ratings remain a separate evaluation unit."
}
